{
    "schema":  "python-slm-backend-selection-decision-v1",
    "phase_id":  "P2",
    "policy_id":  "backend-qualification-v1",
    "status":  "FAIL",
    "owner_review_status":  "AWAITING_REVIEW",
    "selected_candidate_id":  null,
    "selection_criterion":  null,
    "passing_frameworks":  [

                           ],
    "rejected_candidates":  [
                                {
                                    "candidate_id":  "burn-cubecl",
                                    "reason_codes":  [
                                                         "PHASE_TERMINATED_BEFORE_CANDIDATE"
                                                     ]
                                },
                                {
                                    "candidate_id":  "candle",
                                    "reason_codes":  [
                                                         "PHASE_TERMINATED_BEFORE_CANDIDATE"
                                                     ]
                                }
                            ],
    "diagnostic_fallback":  {
                                "status":  "NOT_RUN",
                                "reason":  "The phase terminated before diagnostic fallback eligibility was established."
                            },
    "qualification_run_id":  "20260812T104536746Z-8aba78129f1543e3b9cd1e7a",
    "limitations":  [
                        "primitive_bf16_training_viability_only",
                        "transformer_layer_parity_deferred_to_P10",
                        "full_optimizer_step_deferred_to_P12",
                        "no_vram_fit_claim",
                        "no_tokens_per_second_claim",
                        "no_eight_hour_feasibility_claim"
                    ]
}
